<!--

    Copyright Â© 2024 VenaNocta (venanocta@gmail.com)

    Licensed under the Apache License, Version 2.0 (the "License");
    you may not use this file except in compliance with the License.
    You may obtain a copy of the License at

        http://www.apache.org/licenses/LICENSE-2.0

    Unless required by applicable law or agreed to in writing, software
    distributed under the License is distributed on an "AS IS" BASIS,
    WITHOUT WARRANTIES OR CONDITIONS OF ANY KIND, either express or implied.
    See the License for the specific language governing permissions and
    limitations under the License.

-->
<!-- <goal-execution-order-model xmlns="https://api.runeduniverse.net/runes4tools/r4m-geom" 
	xmlns:xsi="http://www.w3.org/2001/XMLSchema-instance" xsi:schemaLocation="https://api.runeduniverse.net/runes4tools/r4m-geom 
	https://api.runeduniverse.net/runes4tools/r4m-geom-v1_0_0.xsd"> -->
<goal-execution-order-model
	xmlns="https://api.runeduniverse.net/runes4tools/r4m-geom"
	xmlns:xsi="http://www.w3.org/2001/XMLSchema-instance"
	xsi:schemaLocation="https://api.runeduniverse.net/runes4tools/r4m-geom r4m-geom-v1_0_0.xsd">

	<modelVersion>1.0.0</modelVersion>
	<goals>
		<goal id="x">
			<dependents>
				<goal id="x" source="plugin">
					<artifactId>yy</artifactId>
				</goal>
			</dependents>
		</goal>
		<goal id="pack">
			<groupId>
				net.runeduniverse.tools.maven.r4m
			</groupId>
			<artifactId>r4m-maven-extension</artifactId>
			<dependencies>
				<goal id="pre-pack" source="workflow">
					<groupId>
						<!-- (opt - maven groupId) -->
						net.runeduniverse.tools.maven.r4m
					</groupId>
					<artifactId>r4m-maven-extension</artifactId>
					<when>
						<!-- (opt - always) -->
						<!-- conditions following each other inside the <when> block form an 
							OR condition -->
						<always />
						<and>
							<execution id="pipeline" />
							<packaging id="jar" />
							<lifecycle id="clean" />
							<profile id="dev-install" state="inactive" />
							<not>
								<profile id="build" state="provided" />
							</not>
						</and>
					</when>
				</goal>
			</dependencies>
			<dependents>
				<goal id="wrap-pack">
					<groupId>
						<!-- (opt - maven groupId) -->
						net.runeduniverse.tools.maven.r4m
					</groupId>
					<artifactId>r4m-maven-extension</artifactId>
				</goal>
			</dependents>
		</goal>

	</goals>
</goal-execution-order-model>